{
  "schema_version": "1.0",
  "execution_id": "exec_001",
  "request_id": "req_001",
  "status": "allowed",
  "decision": "allow",
  "result": {
    "ok": true
  },
  "reason_code": null,
  "safe_message": "Execution allowed.",
  "pending_reference": null,
  "replay_reference": null,
  "policy_provenance": {
    "bundle_id": "bundle_001",
    "version": "0.2.0",
    "policy_hash": "sha256:abc",
    "environment": "dev",
    "signer_identity": "policy-admin",
    "activated_at": "2026-06-28T00:00:00Z"
  },
  "audit_record_id": "audit_001",
  "completed_at": "2026-06-28T00:00:01Z"
}
